{
  "bitcoincoreProtocol": "http",
  "bitcoincoreHost": "bitcoincore",
  "bitcoincorePort": 8332,
  "bitcoincoreUser": "swapper",
  "bitcoincorePassword": "swapper",
  "bitcoincoreZmqProtocol": "tcp",
  "bitcoincoreZmqPort": 28332,
  "electrumProtocol": "http",
  "electrumHost": "electrum",
  "electrumPort": 30000,
  "electrumUser": "swapper",
  "electrumPassword": "swapper"
}